{
  "schemaVersion": 1,
  "contentVersion": "0.1",
  "settings": {
    "version": "0.1",
    "base_hp": 120,
    "hp_per_level": 8,
    "base_attack": 20,
    "attack_per_level": 2,
    "max_level": 30,
    "base_xp": 80,
    "xp_step": 20,
    "move_speed_mps": 5.2,
    "energy_max": 100,
    "energy_start": 30,
    "stamina_max": 100,
    "dodge_cost": 25,
    "stamina_regen_per_s": 20,
    "stamina_regen_delay_s": 1,
    "attack_interval_s": 0.5,
    "effective_uptime": 0.65,
    "dodge_distance_m": 3.2,
    "dodge_duration_s": 0.35,
    "iframe_start_s": 0.06,
    "iframe_end_s": 0.22,
    "residue_lifetime_s": 20
  },
  "skills": [
    {
      "id": "SK001",
      "name_ko": "파편격",
      "energy_cost": 0,
      "cooldown_s": 0,
      "coefficient": 1,
      "range_m": 2.2,
      "duration_s": 0,
      "unlock_mission": "",
      "slot_type": "common"
    },
    {
      "id": "SK002",
      "name_ko": "회수",
      "energy_cost": 0,
      "cooldown_s": 0,
      "coefficient": 0,
      "range_m": 6,
      "duration_s": 0.4,
      "unlock_mission": "",
      "slot_type": "common"
    },
    {
      "id": "SK003",
      "name_ko": "잔금막",
      "energy_cost": 20,
      "cooldown_s": 8,
      "coefficient": 0,
      "range_m": 3,
      "duration_s": 3,
      "unlock_mission": "M001",
      "slot_type": "active"
    },
    {
      "id": "SK004",
      "name_ko": "견인선",
      "energy_cost": 12,
      "cooldown_s": 4,
      "coefficient": 1.2,
      "range_m": 8,
      "duration_s": 0,
      "unlock_mission": "M001",
      "slot_type": "active"
    },
    {
      "id": "SK005",
      "name_ko": "반납",
      "energy_cost": 30,
      "cooldown_s": 6,
      "coefficient": 3,
      "range_m": 10,
      "duration_s": 0,
      "unlock_mission": "M006",
      "slot_type": "active"
    },
    {
      "id": "SK006",
      "name_ko": "해체점",
      "energy_cost": 25,
      "cooldown_s": 10,
      "coefficient": 2,
      "range_m": 7,
      "duration_s": 0,
      "unlock_mission": "M009",
      "slot_type": "active"
    },
    {
      "id": "SK007",
      "name_ko": "귀환로",
      "energy_cost": 35,
      "cooldown_s": 15,
      "coefficient": 0,
      "range_m": 12,
      "duration_s": 8,
      "unlock_mission": "M012",
      "slot_type": "active"
    },
    {
      "id": "SK008",
      "name_ko": "회수권역",
      "energy_cost": 60,
      "cooldown_s": 30,
      "coefficient": 0,
      "range_m": 9,
      "duration_s": 10,
      "unlock_mission": "M015",
      "slot_type": "ultimate"
    }
  ],
  "enemies": [
    {
      "id": "EN001",
      "name_ko": "균열 추적체",
      "hp": 60,
      "armor": 0,
      "attack": 18,
      "telegraph_s": 0.8,
      "residue_energy": 8,
      "alloy_probability": 0.3,
      "research_probability": 0.05
    },
    {
      "id": "EN002",
      "name_ko": "잔류 포격체",
      "hp": 90,
      "armor": 10,
      "attack": 24,
      "telegraph_s": 0.9,
      "residue_energy": 8,
      "alloy_probability": 0.3,
      "research_probability": 0.05
    },
    {
      "id": "EN003",
      "name_ko": "기업 방벽병",
      "hp": 180,
      "armor": 25,
      "attack": 24,
      "telegraph_s": 0.8,
      "residue_energy": 16,
      "alloy_probability": 0.4,
      "research_probability": 0.1
    },
    {
      "id": "EN004",
      "name_ko": "케이블 포획체",
      "hp": 160,
      "armor": 15,
      "attack": 28,
      "telegraph_s": 1.0,
      "residue_energy": 8,
      "alloy_probability": 0.3,
      "research_probability": 0.05
    },
    {
      "id": "EN005",
      "name_ko": "표지판 의태체",
      "hp": 220,
      "armor": 10,
      "attack": 32,
      "telegraph_s": 1.1,
      "residue_energy": 8,
      "alloy_probability": 0.3,
      "research_probability": 0.05
    },
    {
      "id": "EN006",
      "name_ko": "서기관 파수병",
      "hp": 320,
      "armor": 30,
      "attack": 38,
      "telegraph_s": 1.0,
      "residue_energy": 16,
      "alloy_probability": 0.4,
      "research_probability": 0.1
    },
    {
      "id": "EN007",
      "name_ko": "위상 방출체",
      "hp": 260,
      "armor": 15,
      "attack": 42,
      "telegraph_s": 1.2,
      "residue_energy": 8,
      "alloy_probability": 0.3,
      "research_probability": 0.05
    },
    {
      "id": "EN008",
      "name_ko": "폐문 정예병",
      "hp": 420,
      "armor": 40,
      "attack": 45,
      "telegraph_s": 1.0,
      "residue_energy": 16,
      "alloy_probability": 0.4,
      "research_probability": 0.1
    },
    {
      "id": "BS001",
      "name_ko": "적재장 융합체",
      "hp": 1400,
      "armor": 20,
      "attack": 32,
      "telegraph_s": 1.1,
      "residue_energy": 40,
      "alloy_probability": 0,
      "research_probability": 0
    },
    {
      "id": "BS002",
      "name_ko": "주거 방벽핵",
      "hp": 2400,
      "armor": 25,
      "attack": 38,
      "telegraph_s": 1.2,
      "residue_energy": 40,
      "alloy_probability": 0,
      "research_probability": 0
    },
    {
      "id": "BS003",
      "name_ko": "분기역 수호체",
      "hp": 3600,
      "armor": 30,
      "attack": 44,
      "telegraph_s": 1.3,
      "residue_energy": 40,
      "alloy_probability": 0,
      "research_probability": 0
    },
    {
      "id": "BS004",
      "name_ko": "추방지의 집행자",
      "hp": 4800,
      "armor": 35,
      "attack": 50,
      "telegraph_s": 1.2,
      "residue_energy": 40,
      "alloy_probability": 0,
      "research_probability": 0
    },
    {
      "id": "BS005",
      "name_ko": "역류 실험체",
      "hp": 5800,
      "armor": 35,
      "attack": 54,
      "telegraph_s": 1.2,
      "residue_energy": 40,
      "alloy_probability": 0,
      "research_probability": 0
    },
    {
      "id": "BS006",
      "name_ko": "폐문핵",
      "hp": 7200,
      "armor": 40,
      "attack": 58,
      "telegraph_s": 1.4,
      "residue_energy": 40,
      "alloy_probability": 0,
      "research_probability": 0
    }
  ],
  "missions": [
    {
      "id": "M001",
      "chapter": 1,
      "level_id": "LV001",
      "name_ko": "물류센터 귀환",
      "recommended_level": 1,
      "credits": 400,
      "xp": 100,
      "required_rescues": 7,
      "boss_id": "BS001",
      "objective": "잔향을 회수하고 지지점 2개를 유지해 7명 구조",
      "target_minutes": 20
    },
    {
      "id": "M002",
      "chapter": 1,
      "level_id": "LV002",
      "name_ko": "학교의 안전선",
      "recommended_level": 2,
      "credits": 550,
      "xp": 140,
      "required_rescues": 12,
      "boss_id": "",
      "objective": "방벽으로 복도를 지지하며 12명 대피",
      "target_minutes": 25
    },
    {
      "id": "M003",
      "chapter": 1,
      "level_id": "LV003",
      "name_ko": "남겨진 원본",
      "recommended_level": 4,
      "credits": 800,
      "xp": 200,
      "required_rescues": 0,
      "boss_id": "BS001",
      "objective": "원본 기록 3개 확보 후 강화 융합체 저지",
      "target_minutes": 25
    },
    {
      "id": "M004",
      "chapter": 2,
      "level_id": "LV004",
      "name_ko": "공동 계약",
      "recommended_level": 5,
      "credits": 900,
      "xp": 240,
      "required_rescues": 10,
      "boss_id": "",
      "objective": "주거 지역 배전함 3개 복구",
      "target_minutes": 25
    },
    {
      "id": "M005",
      "chapter": 2,
      "level_id": "LV005",
      "name_ko": "아파트 방벽",
      "recommended_level": 7,
      "credits": 1100,
      "xp": 300,
      "required_rescues": 15,
      "boss_id": "",
      "objective": "방벽 취약점 3곳을 순서대로 해체",
      "target_minutes": 25
    },
    {
      "id": "M006",
      "chapter": 2,
      "level_id": "LV006",
      "name_ko": "일곱 개의 이름",
      "recommended_level": 9,
      "credits": 1400,
      "xp": 400,
      "required_rescues": 20,
      "boss_id": "BS002",
      "objective": "기석의 통로를 방어하고 20명 귀환 확인",
      "target_minutes": 25
    },
    {
      "id": "M007",
      "chapter": 3,
      "level_id": "LV007",
      "name_ko": "열한 번째 아이",
      "recommended_level": 10,
      "credits": 1500,
      "xp": 420,
      "required_rescues": 0,
      "boss_id": "",
      "objective": "생존자 기록과 센서 3개 회수",
      "target_minutes": 25
    },
    {
      "id": "M008",
      "chapter": 3,
      "level_id": "LV008",
      "name_ko": "접히는 노선",
      "recommended_level": 12,
      "credits": 1700,
      "xp": 480,
      "required_rescues": 14,
      "boss_id": "",
      "objective": "접힌 승강장의 2개 경로 연결",
      "target_minutes": 25
    },
    {
      "id": "M009",
      "chapter": 3,
      "level_id": "LV009",
      "name_ko": "서울의 귀환로",
      "recommended_level": 13,
      "credits": 2100,
      "xp": 600,
      "required_rescues": 30,
      "boss_id": "BS003",
      "objective": "BS003 저지 후 도시 제어 3노드 안정화",
      "target_minutes": 25
    },
    {
      "id": "M010",
      "chapter": 4,
      "level_id": "LV010",
      "name_ko": "피난 도시",
      "recommended_level": 15,
      "credits": 2200,
      "xp": 620,
      "required_rescues": 8,
      "boss_id": "",
      "objective": "중립 피난민을 확인하고 통역 기록 확보",
      "target_minutes": 25
    },
    {
      "id": "M011",
      "chapter": 4,
      "level_id": "LV011",
      "name_ko": "앵커의 반대편",
      "recommended_level": 17,
      "credits": 2400,
      "xp": 700,
      "required_rescues": 0,
      "boss_id": "",
      "objective": "인간과 서기관의 피해 기록 대조",
      "target_minutes": 25
    },
    {
      "id": "M012",
      "chapter": 4,
      "level_id": "LV012",
      "name_ko": "아버지의 지도",
      "recommended_level": 18,
      "credits": 2800,
      "xp": 800,
      "required_rescues": 16,
      "boss_id": "BS004",
      "objective": "BS004 저지와 공동 피난 통로 유지",
      "target_minutes": 25
    },
    {
      "id": "M013",
      "chapter": 5,
      "level_id": "LV013",
      "name_ko": "공개할 권리",
      "recommended_level": 20,
      "credits": 2900,
      "xp": 850,
      "required_rescues": 0,
      "boss_id": "",
      "objective": "연구 자료 3노드를 통해 분산 공개",
      "target_minutes": 25
    },
    {
      "id": "M014",
      "chapter": 5,
      "level_id": "LV014",
      "name_ko": "해법의 온도",
      "recommended_level": 21,
      "credits": 3200,
      "xp": 900,
      "required_rescues": 0,
      "boss_id": "",